<?xml version="1.0" encoding="utf-8" standalone="yes"?>
<SchedulingPeriod ID="sprint01" xmlns:xsi="http://www.w3.org/2001/XMLSchema-instance" xsi:noNamespaceSchemaLocation="schedule.xsd">
    <StartDate>2010-01-01</StartDate>
    <EndDate>2010-01-28</EndDate>
    <ShiftTypes>
        <Shift ID="E">
            <StartTime>06:30:00</StartTime>
            <EndTime>14:30:00</EndTime>
            <Description>Early</Description>
        </Shift>
        <Shift ID="L">
            <StartTime>14:30:00</StartTime>
            <EndTime>22:30:00</EndTime>
            <Description>Late</Description>
        </Shift>
        <Shift ID="D">
            <StartTime>08:30:00</StartTime>
            <EndTime>16:30:00</EndTime>
            <Description>Day shift</Description>
        </Shift>
        <Shift ID="N">
            <StartTime>22:30:00</StartTime>
            <EndTime>06:30:00</EndTime>
            <Description>Night</Description>
        </Shift>
    </ShiftTypes>
    <Employees>
        <Employee ID="0">
            <ContractID>0</ContractID>
            <Name>0</Name>
            <HoursRemaining>200</HoursRemaining>
        </Employee>
        <Employee ID="1">
            <ContractID>0</ContractID>
            <Name>1</Name>
            <HoursRemaining>200</HoursRemaining>
        </Employee>
        <Employee ID="2">
            <ContractID>0</ContractID>
            <Name>2</Name>
            <HoursRemaining>200</HoursRemaining>
        </Employee>
        <Employee ID="3">
            <ContractID>0</ContractID>
            <Name>3</Name>
            <HoursRemaining>200</HoursRemaining>
        </Employee>
        <Employee ID="4">
            <ContractID>1</ContractID>
            <Name>4</Name>
            <HoursRemaining>200</HoursRemaining>
        </Employee>
        <Employee ID="5">
            <ContractID>1</ContractID>
            <Name>5</Name>
            <HoursRemaining>200</HoursRemaining>
        </Employee>
        <Employee ID="6">
            <ContractID>2</ContractID>
            <Name>6</Name>
            <HoursRemaining>200</HoursRemaining>
        </Employee>
        <Employee ID="7">
            <ContractID>2</ContractID>
            <Name>7</Name>
            <HoursRemaining>200</HoursRemaining>
        </Employee>
        <Employee ID="8">
            <ContractID>3</ContractID>
            <Name>8</Name>
            <HoursRemaining>200</HoursRemaining>
        </Employee>
        <Employee ID="9">
            <ContractID>3</ContractID>
            <Name>9</Name>
            <HoursRemaining>200</HoursRemaining>
        </Employee>
    </Employees>
    <DayOffRequests>
        <DayOff weight="1">
            <EmployeeID>0</EmployeeID>
            <Date>2010-01-02</Date>
        </DayOff>
        <DayOff weight="1">
            <EmployeeID>0</EmployeeID>
            <Date>2010-01-08</Date>
        </DayOff>
        <DayOff weight="1">
            <EmployeeID>0</EmployeeID>
            <Date>2010-01-07</Date>
        </DayOff>
        <DayOff weight="1">
            <EmployeeID>0</EmployeeID>
            <Date>2010-01-05</Date>
        </DayOff>
        <DayOff weight="1">
            <EmployeeID>0</EmployeeID>
            <Date>2010-01-15</Date>
        </DayOff>
        <DayOff weight="1">
            <EmployeeID>0</EmployeeID>
            <Date>2010-01-04</Date>
        </DayOff>
        <DayOff weight="1">
            <EmployeeID>0</EmployeeID>
            <Date>2010-01-25</Date>
        </DayOff>
        <DayOff weight="1">
            <EmployeeID>0</EmployeeID>
            <Date>2010-01-16</Date>
        </DayOff>
        <DayOff weight="1">
            <EmployeeID>0</EmployeeID>
            <Date>2010-01-01</Date>
        </DayOff>
        <DayOff weight="1">
            <EmployeeID>0</EmployeeID>
            <Date>2010-01-27</Date>
        </DayOff>
        <DayOff weight="1">
            <EmployeeID>1</EmployeeID>
            <Date>2010-01-20</Date>
        </DayOff>
        <DayOff weight="1">
            <EmployeeID>1</EmployeeID>
            <Date>2010-01-15</Date>
        </DayOff>
        <DayOff weight="1">
            <EmployeeID>1</EmployeeID>
            <Date>2010-01-18</Date>
        </DayOff>
        <DayOff weight="1">
            <EmployeeID>1</EmployeeID>
            <Date>2010-01-11</Date>
        </DayOff>
        <DayOff weight="1">
            <EmployeeID>1</EmployeeID>
            <Date>2010-01-17</Date>
        </DayOff>
        <DayOff weight="1">
            <EmployeeID>1</EmployeeID>
            <Date>2010-01-04</Date>
        </DayOff>
        <DayOff weight="1">
            <EmployeeID>1</EmployeeID>
            <Date>2010-01-08</Date>
        </DayOff>
        <DayOff weight="1">
            <EmployeeID>1</EmployeeID>
            <Date>2010-01-07</Date>
        </DayOff>
        <DayOff weight="1">
            <EmployeeID>1</EmployeeID>
            <Date>2010-01-23</Date>
        </DayOff>
        <DayOff weight="1">
            <EmployeeID>1</EmployeeID>
            <Date>2010-01-06</Date>
        </DayOff>
        <DayOff weight="1">
            <EmployeeID>2</EmployeeID>
            <Date>2010-01-08</Date>
        </DayOff>
        <DayOff weight="1">
            <EmployeeID>2</EmployeeID>
            <Date>2010-01-01</Date>
        </DayOff>
        <DayOff weight="1">
            <EmployeeID>2</EmployeeID>
            <Date>2010-01-21</Date>
        </DayOff>
        <DayOff weight="1">
            <EmployeeID>2</EmployeeID>
            <Date>2010-01-16</Date>
        </DayOff>
        <DayOff weight="1">
            <EmployeeID>2</EmployeeID>
            <Date>2010-01-04</Date>
        </DayOff>
        <DayOff weight="1">
            <EmployeeID>2</EmployeeID>
            <Date>2010-01-22</Date>
        </DayOff>
        <DayOff weight="1">
            <EmployeeID>2</EmployeeID>
            <Date>2010-01-14</Date>
        </DayOff>
        <DayOff weight="1">
            <EmployeeID>2</EmployeeID>
            <Date>2010-01-09</Date>
        </DayOff>
        <DayOff weight="1">
            <EmployeeID>2</EmployeeID>
            <Date>2010-01-17</Date>
        </DayOff>
        <DayOff weight="1">
            <EmployeeID>2</EmployeeID>
            <Date>2010-01-20</Date>
        </DayOff>
        <DayOff weight="1">
            <EmployeeID>3</EmployeeID>
            <Date>2010-01-14</Date>
        </DayOff>
        <DayOff weight="1">
            <EmployeeID>3</EmployeeID>
            <Date>2010-01-21</Date>
        </DayOff>
        <DayOff weight="1">
            <EmployeeID>3</EmployeeID>
            <Date>2010-01-17</Date>
        </DayOff>
        <DayOff weight="1">
            <EmployeeID>3</EmployeeID>
            <Date>2010-01-20</Date>
        </DayOff>
        <DayOff weight="1">
            <EmployeeID>3</EmployeeID>
            <Date>2010-01-16</Date>
        </DayOff>
        <DayOff weight="1">
            <EmployeeID>3</EmployeeID>
            <Date>2010-01-25</Date>
        </DayOff>
        <DayOff weight="1">
            <EmployeeID>3</EmployeeID>
            <Date>2010-01-10</Date>
        </DayOff>
        <DayOff weight="1">
            <EmployeeID>3</EmployeeID>
            <Date>2010-01-13</Date>
        </DayOff>
        <DayOff weight="1">
            <EmployeeID>3</EmployeeID>
            <Date>2010-01-09</Date>
        </DayOff>
        <DayOff weight="1">
            <EmployeeID>3</EmployeeID>
            <Date>2010-01-18</Date>
        </DayOff>
        <DayOff weight="1">
            <EmployeeID>4</EmployeeID>
            <Date>2010-01-18</Date>
        </DayOff>
        <DayOff weight="1">
            <EmployeeID>4</EmployeeID>
            <Date>2010-01-07</Date>
        </DayOff>
        <DayOff weight="1">
            <EmployeeID>4</EmployeeID>
            <Date>2010-01-02</Date>
        </DayOff>
        <DayOff weight="1">
            <EmployeeID>4</EmployeeID>
            <Date>2010-01-28</Date>
        </DayOff>
        <DayOff weight="1">
            <EmployeeID>4</EmployeeID>
            <Date>2010-01-17</Date>
        </DayOff>
        <DayOff weight="1">
            <EmployeeID>4</EmployeeID>
            <Date>2010-01-21</Date>
        </DayOff>
        <DayOff weight="1">
            <EmployeeID>4</EmployeeID>
            <Date>2010-01-24</Date>
        </DayOff>
        <DayOff weight="1">
            <EmployeeID>4</EmployeeID>
            <Date>2010-01-06</Date>
        </DayOff>
        <DayOff weight="1">
            <EmployeeID>4</EmployeeID>
            <Date>2010-01-04</Date>
        </DayOff>
        <DayOff weight="1">
            <EmployeeID>4</EmployeeID>
            <Date>2010-01-10</Date>
        </DayOff>
        <DayOff weight="1">
            <EmployeeID>5</EmployeeID>
            <Date>2010-01-04</Date>
        </DayOff>
        <DayOff weight="1">
            <EmployeeID>5</EmployeeID>
            <Date>2010-01-22</Date>
        </DayOff>
        <DayOff weight="1">
            <EmployeeID>5</EmployeeID>
            <Date>2010-01-14</Date>
        </DayOff>
        <DayOff weight="1">
            <EmployeeID>5</EmployeeID>
            <Date>2010-01-07</Date>
        </DayOff>
        <DayOff weight="1">
            <EmployeeID>5</EmployeeID>
            <Date>2010-01-27</Date>
        </DayOff>
        <DayOff weight="1">
            <EmployeeID>5</EmployeeID>
            <Date>2010-01-25</Date>
        </DayOff>
        <DayOff weight="1">
            <EmployeeID>5</EmployeeID>
            <Date>2010-01-17</Date>
        </DayOff>
        <DayOff weight="1">
            <EmployeeID>5</EmployeeID>
            <Date>2010-01-20</Date>
        </DayOff>
        <DayOff weight="1">
            <EmployeeID>5</EmployeeID>
            <Date>2010-01-09</Date>
        </DayOff>
        <DayOff weight="1">
            <EmployeeID>5</EmployeeID>
            <Date>2010-01-23</Date>
        </DayOff>
        <DayOff weight="1">
            <EmployeeID>6</EmployeeID>